{
  "schema_version": 1,
  "character": "pip",
  "engine": "kokoro",
  "voices": [{ "id": "af_heart", "weight": 1 }],
  "speed": 1.08,
  "pitch_semitones": 2,
  "loudness_lufs": -20,
  "notes": "Cast by the owner on 2026-10-22 (casting page c12): af_heart, +2 semitones, 8% faster. Child-like and bright."
}
